{
  "schemaVersion": "1",
  "repository": null,
  "phase": null,
  "sourceSha": null,
  "baseSha": null,
  "eventSha": null,
  "prHeadSha": null,
  "workflowSha": null,
  "mergeSha": null,
  "workflowRunId": null,
  "runAttempt": null,
  "eventName": null,
  "startedAt": null,
  "completedAt": null,
  "toolchain": null,
  "platform": null,
  "dirtyTrackedFiles": null,
  "fixtureSetDigest": null,
  "requiredTestIds": null,
  "executed": null,
  "passed": null,
  "failed": null,
  "skipped": null,
  "retries": null,
  "artifacts": null,
  "result": "pending",
  "reviewer": null,
  "reviewedAt": null,
  "residuals": null
}
